{
  "$schema": "../../schemas/assurance-mapping.schema.json",
  "version": 1,
  "id": "example-minimal",
  "framework": {
    "id": "example-framework",
    "source_authority": "adopter-extension"
  },
  "requirement": {
    "id": "AC-7"
  },
  "applicability": {
    "status": "unassessed"
  },
  "created": "2026-09-14",
  "updated": "2026-09-14"
}
